{
  "contract_version": "1.1.0",
  "generated_at": "2026-09-29T17:56:40Z",
  "live_since": "2026-09-29T16:31:51Z",
  "chain_verified": true,
  "counts": {
    "locks": 0,
    "voided": 0,
    "invalid": 0,
    "missed": 0,
    "scored": 0,
    "awaiting_result": 0,
    "awarded_not_scored": 0
  },
  "competitions": [
    {
      "id": "all",
      "n": 0,
      "comparisons": [
        {
          "against": "base rates",
          "n": 0,
          "model_log_loss": null,
          "other_log_loss": null,
          "diff": null,
          "ci95": null,
          "first_half": null,
          "second_half": null,
          "verdict": "no scored matches yet",
          "matches_needed": null
        },
        {
          "against": "market",
          "n": 0,
          "model_log_loss": null,
          "other_log_loss": null,
          "diff": null,
          "ci95": null,
          "first_half": null,
          "second_half": null,
          "verdict": "no scored matches yet",
          "matches_needed": null
        }
      ]
    }
  ],
  "calibration": [],
  "matches": [],
  "notes": [
    "Only predictions locked before kick-off by the daily run are scored. Backtests and any retrospective predictions are never mixed in.",
    "Differences are model minus the other forecaster in log loss (negative = model better), with a 95% interval. With few matches the intervals are wide; `matches_needed` is roughly how many matches it would take to detect a gap the size the backtest found (0.08 against base rates, 0.02 against the market).",
    "Market probabilities come from closing odds with the margin removed proportionally (an assumption). They appear a few days after each match."
  ]
}
